{
  "id": "built-for-pressure",
  "name": "Built for Pressure â€” 1 Faceless Video Campaign",
  "product": {
    "title": "Mind Warriors",
    "type": "campaign"
  },
  "brandPillars": [
    "Built for Pressure Fundamentals",
    "Built for Pressure Mistakes & Myths",
    "Built for Pressure Frameworks",
    "Built for Pressure In Practice",
    "Built for Pressure Systems & Habits"
  ],
  "contentBrief": {
    "objective": "Participation",
    "audiences": [
      "Athletes"
    ],
    "coreMessage": "Composure is demonstrated by how an athlete responds and returns to the next right action under pressure.",
    "callToAction": "Train The Mind Challenge",
    "contentPrinciples": [
      "Coach voice",
      "Evidence-aware",
      "No unverified performance claims"
    ],
    "sourceAuthority": [
      "Mind Warriors Communications Hub (operator-provided brief text; NOT independently verified against the hub repository — access was unavailable this session)"
    ],
    "claimConstraints": [
      "Use only claims supported by the governed communications source."
    ],
    "defaultFormat": "60-second vertical video"
  },
  "targetVideoCount": 1,
  "status": "Not Started",
  "createdAt": "2026-06-24T00:00:00.000Z",
  "statusModel": [
    "Not Started",
    "Researching",
    "Blueprint Ready",
    "Script Ready",
    "Voice Ready",
    "Visuals Ready",
    "Render Ready",
    "Human Review",
    "Approved",
    "Publish Ready",
    "Published",
    "Blocked"
  ],
  "maps": {
    "posture": "Machine Assisted, Person Supervised",
    "note": "Human approval is required at decision firewalls. Approval gates are blocking states represented in code and data; they are not engineered around.",
    "approvalFirewalls": [
      {
        "id": "blueprint-approval",
        "phase": "03",
        "label": "Human Blueprint Approval",
        "blocking": true,
        "state": "Not Reached"
      },
      {
        "id": "inspector-review",
        "phase": "07",
        "label": "Inspector / Human Review",
        "blocking": true,
        "state": "Not Reached"
      }
    ]
  },
  "provenance": {
    "origin": "Generated by the deterministic Campaign Intake Engine from operator topic \"Built for Pressure\". All titles/summaries are template-derived; no external research source was queried.",
    "dataSource": "mock",
    "notReal": [
      "video rendering",
      "voiceover synthesis",
      "visual generation",
      "YouTube/TikTok publishing",
      "analytics ingestion",
      "external APIs"
    ],
    "disclaimer": "All pipeline activity in this build is mock/prototype data. No rendering, publishing, analytics, or external APIs are connected. Statuses are illustrative of the governed state model only."
  },
  "videos": [
    {
      "id": "BP-01",
      "title": "Built for Pressure",
      "summary": "Composure is demonstrated by how an athlete responds and returns to the next right action under pressure.",
      "authorityPillar": "Built for Pressure Fundamentals",
      "targetDurationSeconds": 60,
      "creativeIntent": {
        "audience": "Athletes",
        "message": "Composure is demonstrated by how an athlete responds and returns to the next right action under pressure.",
        "objective": "Participation",
        "format": "60-second vertical video",
        "callToAction": "Train The Mind Challenge"
      },
      "status": "Not Started",
      "review": {
        "required": true,
        "decision": "Not Reached",
        "reviewer": null,
        "note": "Not yet entered the production line."
      },
      "agentState": {
        "stage": "Not Started",
        "assignedAgent": "intake-agent",
        "note": "Queued at campaign intake (operator-generated campaign).",
        "mock": true
      },
      "mock": true
    }
  ]
}
